"Status","Start Time","Stop Time","Duration in ms","Parent Suite","Suite","Sub Suite","Test Class","Test Method","Name","Description"
"passed","Thu Oct 16 03:37:55 GMT 2025","Thu Oct 16 03:37:59 GMT 2025","3921","chromium","login.spec.ts","Multiple Login Tests","","","should log in and validate post-login details for user: test_user1@villageIT.com",""
"passed","Thu Oct 16 03:38:03 GMT 2025","Thu Oct 16 03:38:06 GMT 2025","3351","chromium","login.spec.ts","Multiple Login Tests","","","should log in and validate post-login details for user: test_user3@villageIT.com",""
"passed","Thu Oct 16 03:38:00 GMT 2025","Thu Oct 16 03:38:03 GMT 2025","2698","chromium","login.spec.ts","Multiple Login Tests","","","should log in and validate post-login details for user: test_user2@villageIT.com",""
"passed","Thu Oct 16 03:37:55 GMT 2025","Thu Oct 16 03:37:57 GMT 2025","1563","chromium","forgotPassword.spec.ts","Forgot Password Flow","","","Forgot Password - Valid Email",""
"passed","Thu Oct 16 03:37:58 GMT 2025","Thu Oct 16 03:37:59 GMT 2025","675","chromium","forgotPassword.spec.ts","Forgot Password Flow","","","Forgot Password - Back to Login",""
"passed","Thu Oct 16 03:37:55 GMT 2025","Thu Oct 16 03:37:57 GMT 2025","1602","chromium","appState.spec.ts","Challenge 4 - Application State","","","Validate login, profile interactions, and logout",""
"passed","Thu Oct 16 03:37:55 GMT 2025","Thu Oct 16 03:38:05 GMT 2025","10192","chromium","interactiveLogin.spec.ts","Challenge 2 - Animated Form, Menu Interactions, and Logout","","","should handle login, menu interactions, and logout",""
